id	text	label
40380	"Obama sostuvo que ""los derechos universales de reunión y libertad de expresión deben ser respetados"" y que Estados Unidos ""apoya a todos quienes buscan ejercer estos derechos""."	0
41642	Mientras el fenómeno creció, el Gobierno de la Ciudad tiene una capacidad limitada para evitarlo, ya que en muchos casos se trata de viviendas privadas cuya situación debe solucionar la Justicia.	0
41599	Las primeras universidades eran universales e ilimitadas con eruditos yendo y viniendo al norte y sur de los Alpes y de centros de aprendizaje cristianos a otros musulmanes.	0
43060	Con el 95,5% de los votos escrutados, Evo Morales ​obtenía el 46,34%, contra el 37,17% de su principal rival, Carlos Mesa, una diferencia que dejaba al presidente a un puñado de votos para poder evitar una segunda vuelta.	0
42849	"Ante la medida de fuerza, los telefónicos de todo el país agrupados en la federación nacional (Foeesitra) declararon un paro de 24 horas para el martes, con ""toma de servicios y abandono de tareas desde las 11 para marchar hacia los edificios de las empresas"", señalaron a la agencia Télam fuentes gremiales del interior."	1
42680	"También señala que entre los heridos figura Martín Ludovico Marro, quien ""se encuentra internado en el Presbiterian Hospital de Manhattan recuperándose de las heridas sufridas, y encontrándose fuera de peligro según el parte médico oficial""."	0
41235	El ministro buscó eludir la responsabilidad de su Gobierno en haber otorgado TBA a un grupo de vaciadores”, dijo a PáginaI12 Marcelo Ramal, del PO.	0
40829	Es decir, se comprometió con el testimonio, la historia y la imagen (como documentación, como disparador de un proceso indagatorio, de investigación).	0
41332	La política exterior estadounidense se siente más a gusto con categorías de bien y mal que con los cálculos de interés nacional de la diplomacia de gabinete europea.	0
40741	Si todo esto forma parte de las presiones bajo la mesa o si el norte mundial va más allá del proclamado diferendo nuclear para inducir un recorte de la autonomía iraní y conformar a Riad o a Israel, el otro enemigo jurado de las conversaciones.	0
41297	Era Adela quien, con un rosario en la mano, caminaba por el pasillo de la iglesia, se acercaba para tocar la mano de una madre y con ese gesto tapaba el pase de un papelito con el lugar de futuro encuentro.	0
42512	Recibió varias puñaladas en los brazos, pero hubo dos cuchilladas mortales.	0
42561	Los escuadrones de artificieros hacían estallar explosivos para volar las minas que fueron sembradas en la vasta instalación ubicada en el desierto del Sahara, a no mucha distancia de la frontera con Libia.	1
42368	El cambio de orden se produjo mientras las autoridades mexicanas parecen estar confusas y divididas en cuanto a su enfoque hacia la caravana, que a pesar de todo no cesa en su marcha.	0
42733	Mientras los técnicos de las corporaciones del campo irán a Agricultura, los presidentes de las cámaras meterán presión con una marcha a la basílica de Luján.	0
42918	JL: ¿Cómo podés estar en la Argentina y estar en contra de la propiedad privada?	0
40737	No sé ni cómo llegó hasta mi casa”, contó su hermano.	0
41046	Allá vamos.	0
42461	"La publicación de cuyo consejo editorial fue despedida es ""El traductor: estudios en comunicación intercultural"", un título para saborear."	0
43230	"Las negociaciones en el Congreso norteamericano se empantanaron tras el estallido del ""escándalo de la parapolítica"" en Colombia, que vinculó con paramilitares de ultraderecha a legisladores, militares, alcaldes, empresarios, funcionarios y ex funcionarios del actual gobierno."	0
43350	Por eso se tomaron decisiones difíciles.Lo mismo dirá sobre otros pasajes dramáticos de su gobierno.	0
42873	El alegato, cuya polémica hizo que la propia Deneuve pidiera disculpas, ¿puede leerse como reacción a cierto punitivismo pacato que afecta al #Metoo?	0
42161	La muestra, que puede recorrerse en Proa, es un fragmento de la exposición original, curada por Judy Keller, Idurre Alonso y Rodrigo Alonso.	0
42906	En paralelo, los docentes también sostienen un acampe frente a la Legislatura, en Rawson, y hubo movilizaciones en diferentes ciudades patagónicas.En ese contexto, el presidente del bloque de diputados provincial, Blas Meza Evans, confirmó que se pedirá la mediación del obispo de Comodoro Rivadavia, Joaquín Gimno Lahoz, para tratar de solucionar el conflicto y mediar entre las partes.	1
40629	Hasta aquí resaltan las líneas que como vías férreas unen a las derechas clásicas argentinas de otras épocas con esta que ahora gobierna.	0
41994	Espinoza y Urribarri estuvieron acompañados sobre el escenario por las diputadas nacionales Diana Conti y Carolina Gaillard; los referentes de la Corriente Nacional Martín Fierro, Quito Aragón, y de Descamisados, Marcelo Köenig, y dirigentes sindicales como Norberto Di Próspero (empleados legislativos), José Luis Casares (secretario general de la seccional Zona Norte de la CGT bonaerense), entre otros.	0
42056	Allí hay un Estado Plurinacional porque se hizo una Asamblea Constituyente y la gente lo decidió así.	0
41336	De acuerdo con el mapa de la futura concesión, las nuevas zonas deberán respetar los límites de las comunas.	0
40495	La más llamativa estuvo a cargo del abogado de Mubarak, Yosri Abdel Razeq.	0
42448	Es un estadounidense de 27 años y origen dominicano, que buscaba atacar comisarías, servicios postales y entidades del gobierno.	1
42253	El lunes, en una inspección ocular en cercanías del Puente Bosch, en Barracas, los jueces junto a fiscales, abogados y solo algunos acusados recorrieron e lugar donde cayó muerto el joven del Partido Obrero, cuando reclamaba la incorporación a planta permanente de un grupo de empleados tercerizados.	1
42587	El celebrado Mario Testino, fotógrafo fashionista, fue señalado como acosador por modelos y asistentes.	0
41910	Policías y efectivos de la milicia Basij, progubernamental, patrullaban las calles de Teherán, particularmente los distritos comerciales céntricos.	0
41299	Fue cuando Diego Aconza esperaba la luz verde en el semáforo de 7 y 46, subido a su motito DKW, y de pronto se le vinieron encima ente 20 y 30 motos que lo arrastraron casi media cuadra por el pavimento.	0
40314	El circuito de Bush no incluyó a la Argentina, que fue escenario de un promocionado acto del principal enemigo de Estados Unidos en la región: el presidente de Venezuela, Hugo Chávez.	0
41074	Ésos fueron los tonos elegidos para aunar el reclamo de #NiUnaMenos.	0
40711	Había vallas y unos cincuenta policías custodiaban la entrada.	0
42047	Está entrenado para la guerra de guerrillas, su cuerpo ha resistido la instrucción y es un integrante más del Movimiento 26 de Julio.	0
40052	Estoy acá por la lucha de la equidad de género, pero me da lástima ver la plaza politizada.	0
40869	¿Puede haber algo más trascendente que sacar de la Casa de Gobierno a quien viola las leyes de la república?	0
41399	- El ataque fue percibido por el sargento Díaz que estaba durmiendo en un lugar contiguo.	0
43077	en su lucha contra el terrorismo.	0
42276	Hace 12 años que el movimiento sindical tiene paritarias libres y es la primera vez que sucede eso en la historia de la Argentina; el Consejo del Salario funciona año tras año de manera ininterrumpida; se generaron más de cinco millones de puestos de trabajo que, además del beneficio que significó para la clase trabajadora, le valió al sindicalismo una recuperación de volumen y protagonismo en la sociedad.	0
42724	De manera tal que este paro no tiene nada que ver con los intereses reales de los trabajadores.	0
43309	Un día antes, el martes, el vocero del Departamento de Estado afirmó que en Brasil se respetan las instituciones y respondió que no tenía ningún comentario que hacer cuando le preguntaron sobre el contenido de las grabaciones hechas por Sergio Machado en su papel de “delator premiado”.	0
40460	El lunes, después de la medianoche, una banda de unos 20 motoqueros arrojó pedazos de baldosas contra el Centro de Monitoreo Público (MOPU) que la comuna platense tiene en diagonal 74 y 46.	1
43083	Desde que se instaló en la Casa Rosada la coalición que emergió por voluntad popular, desistió de su plataforma electoral para perseguir en vano la aprobación del FMI y de sus seguidores.	0
42829	En la respuesta segunda al juez, en el punto C, Schenone contestó a la pregunta sobre las bases de datos con las que cuenta Gendarmería.	0
41484	Hirió con un disparo de bala a un joven de la comunidad, desfiguró el rostro de una anciana y golpeó a la lonko, Violeta Velázquez, que estaba embarazada.	1
42404	La protesta callejera se desarrollaba ruidosa en el centro de la ciudad pero dentro de marcos de contención previstos por los dirigentes.	1
40151	Dijo que pudo haberse tratado de un ataque terrorista.	0
42374	Fue por una operación policial de la ONU para desalojar a los serbios que ocupaban dos de sus tribunales de Mitrovica.	1
42794	Como el que habita De la Rúa, al fin y al cabo un político que desde hace diez años pelea, solo, en círculos, por recuperar, aunque sea en parte, la mirada piadosa de los otros.	0
40925	Fue una actuación para Cristina y para levantar el ánimo de la tribuna.	0
40443	Pero, fundamentalmente, Pérez mostró que también en las elecciones presidenciales y en el ballottage de 2015, entre Mauricio Macri y Daniel Scioli, los primeros telegramas que se cargaron fueron favorables a Cambiemos y que luego el kirchnerismo achicó diferencias.	0
40643	El Partido Popular con un Mariano Rajoy dispuesto a “limpiar todo”, llega a fines del 2011 con un paquete que incluye la reforma laboral, subas del IVA y recortes generalizados en salud y educación.	0
40908	Trump ha calificado a los migrantes de “criminales” y acusa a la caravana de impulsar una “invasión”.	0
41806	Surge entonces la curaduría por default que, amparada en la pedagogía, reedita, reencuadra, retoca y presenta las obras de tal manera que ya nada tienen que ver con lo que alguna vez quiso el artista.	0
42646	Analizan presentarse en las elecciones presidenciales del próximo año.	0
42793	Para ejemplo, mostraron al Grupo Vila-Manzano que recibe un 900% más de publicidad oficial y que antes se manifestaba en contra de la Ley de Medios.	0
42929	"""No dejemos que nos confundan: estamos hartos de ella, (pero) son lo mismo, son más de lo mismo."	0
40065	Más de 800 centroamericanos de la Caravana del Migrante entraron durante la mañana de ayer a la ciudad de Tijuana, en México, y se instalaron en el Parque de la Amistad.	0
41724	Aun si el ejército se hubiera enfrentado a disparos y bombas de petróleo, una investigación objetiva será necesaria para saber si la escala y la ferocidad de la respuesta eran justificadas.	1
42978	Bush ya pidió al Congreso 3900 millones de dólares en el marco del Plan Colombia II para mantener su apoyo durante los próximos siete años, pero enfrenta la fuerte oposición de los demócratas, que exigen mejoras en materia de derechos humanos por parte del gobierno de Uribe.	0
41826	El presidente Néstor Kirchner repudió esta tarde la violenta represión contra docentes en Neuquén, que provocó la muerte del profesor Carlos Fuentealba, al tiempo que rechazó que la protesta haya sido consecuencia del aumento a maestros otorgado por el Gobierno nacional.	1
42238	Cuando logre depositarlos -con ayuda de la Casa Rosada- la gobernadora deberá salir a buscar financiamiento para comenzar a pagar los sueldos del próximo mes.	0
42730	Habrá que esperar el resultado de las negociaciones que encrespan en Ginebra las espaldas de los últimos señores feudales de esta era.	0
40385	El Foro Empresarial, al que asistieron casi mil hombres de negocios del hemisferio, entregó sus sugerencias a la cumbre ministerial, que hoy cerrará su reunión en la Cancillería argentina con un documento borrador que será analizado por los presidentes americanos en Quebec, Canadá, del 20 al 22 de abril.	0
43143	Su cadáver fue arrojado camino a Chacras de la Merced” en las afueras de la ciudad.	0
40758	Alivio de las familias de los muertos Cierta alegría: se emocionaron al oír la sentencia que tanto esperaban para calmar, de alguna manera, el dolor por las pérdidas.	0
43356	"De Narváez resaltó además que ""ahora nos encontramos con un intendente que es más de lo mismo."	0
40077	"Una alta fuente de la Cancillería le dijo a Clarín que ""es una excusa ridícula que se nos acuse de injerencia en asuntos internos, cuando la Justicia acusó a diversos funcionarios iraníes que están con pedido de captura de Interpol"".La nominación de Vahidi como nuevo ministro de Defensa suscitó el viernes el repudio generalizado de los tres poderes del Estado argentino y de la comunidad judía."	0
42546	JL: Pero por un lado querés que el Estado esté y por otro lado no... JH: Yo quiero que se respeten nuestros derechos.	0
43290	Las manifestaciones han pulsado la politización: desde el reclamo contra la violencia –“vivas nos queremos” es la forma de nombrar que en el país cada día ocurre un femicidio y que el aborto es la principal causa de muerte materna– hasta la discusión de lo que entendemos por trabajo, eje del próximo paro internacional del 8 de marzo, Día Internacional de la Mujer.	0
43340	Los agresores la tomaron de la ropa, la arrastraron unos diez metros por el suelo, le dispararon dos balazos calibre .45, y escaparon en el mismo rodado en el que llegaron y sin robar nada.	1
42014	"Un llamado para inspirar al general"" El general Jorge Zamudio le daba vueltas y vueltas al texto, pero la versión no lo conformaba para nada."	0
42813	De esta manera, los gobiernos de Cristina Kirchner y de Mahmud Ahmadinejad siguen al pie de la letra el plan diseñado hace tiempo pero oficializado el pasado 27 de setiembre en Nueva York por los cancilleres Héctor Timerman y Ali Akbar Salehi.	0
41159	Muchos automovilistas tocan bocina y saludan.	1
43068	Nunca he visto algo así, ni aun durante la primera revolución, de enero de 2011.	1
42304	Este gravamen es el eje del reclamo del sindicato petrolero de Santa Cruz, que el martes último desató una revuelta gremial en la localidad santacruceña de Las Heras que terminó con el asesinato del suboficial de policía Jorge Sayago y con 10 efectivos heridos.	1
40842	¿Cuán cierta su sensación de culpa por aquellos días de derrumbe?	0
41856	En otros puntos la policía obligó a las camionetas sobrecargadas a dejar a los migrantes.	0
41614	"La empresa reconoció que muchos usuarios ""se enojaron por el corte"", pero agregó que ""llama la atención"" el incendio en el primer vagón de la formación: ""Alguien metió una barreta de hierro en una caja de fusibles y no todo el mundo conoce ese mecanismo""."	1
40870	Desde la sede de Trabajo, los representantes se trasladarán a un salón en Jaramillo al 3.000, donde se llevará a cabo, a partir de las 19, la asamblea en la que les comunicarán a los pilotos los resultados del encuentro que busca destrabar el conflicto.	0
40497	El tribunal que juzga el crimen de Mariano Ferreyra escuchó hoy una serie de grabaciones telefónicas que dejaron expuestos los nexos políticos con el gobierno nacional del ex titular de la Unión Ferroviaria José Pedraza, acusado de haber instigado el crimen del militante del Partido Obrero durante una protesta de empleados tercerizados.	1
40269	JH: Tenemos los documentos de la truchada que hicieron los ingleses en 1928.	0
42342	Una, en la boca, que prácticamente le destrozó el maxilar; la otra le quebró una costilla.	0
42287	Allá lejos, se pudo codear con otros ex hombres de Estado, que lo hacen sentir importante o le recuerdan que alguna vez fue importante.	0
42692	Desde la Casa Rosada avalaron sus dichos, aunque también hubo correcciones.	0
41342	El policía Gonzalo Kapp, autor de los disparos, tiene su casa a unas cuatro cuadras de los Rotella y su hija conocía a Lucas .	0
40577	e Irán, influye de formas diferentes en el destino de estos dos enormes rivales regionales.	0
40500	Rechazó también una relación entre los hechos de violencia y el aumento a los maestros que otorgó la Nación.	0
40754	“Parece que en un momento vieron un patrullero que pasa y pega la vuelta.	0
42059	No es casual que en este piso se hable del valor de la imágenes en la construcción de la patria.	0
42743	Para ellos en Baradero las cosas no podrán seguir como si no hubiera pasado nada.	0
41978	"""Hay gente que verifica las identificaciones de los soldados que quieren abordar el autobús"", explicó un vocero del Ejército."	0
42683	Los docentes de la provincia de Chubut están llevando adelante un acampe en la playa de tanques de reserva de combustibles de YPF ubicada en Comodoro Rivadavia que funciona como distribuidora para las ciudades ubicadas al sur de la provincia y el noroeste de Santa Cruz.	1
41633	Unas dos horas más tarde se produjo otro tiroteo en el lado opuesto del campus de la Universidad Politécnica de Virgina, en el que murieron otras 30 personas.	0
41929	Y se reunió con el presidente de la Corte Suprema, Ricardo Lorenzetti.	0
40669	Aparentemente, algo así ocurrió el sábado a la madrugada, sólo que esta vez terminó en tragedia.	0
40489	No sé por qué hicieron esto, pero fue deliberado.	0
40459	El atentado es el acto de violencia más grave en Gaza desde que Israel y Hamas acordaran un alto el fuego, en junio.	1
40712	La misma no quiso decir el día, y en las oficinas del canciller Héctor Timerman no informan al respecto.	0
42295	"Massa aseguró que su función será ""trabajar en todas las áreas"" del Gobierno, ""articulando el funcionamiento del Estado""."	0
42035	No esperemos hasta que sea tarde”, señaló.	0
42446	—¿Pero aceptan venderlo a EE.UU.?	0
42844	Los hackers difundieron imágenes y supuestos mensajes del Estado Islámico.	1
42671	Según su hermano, desde su detención tiene costillas rotas y hemorragias internas.	0
42917	Un ciudadano estadounidense fue detenido hoy por las autoridades de Nueva York mientras preparaba un atentado con bombas caseras contra la policía, servicios postales y entidades del gobierno, informó el alcalde Michael Bloomberg.	1
42702	Sólo de nuestro lado.	0
42127	El violeta simboliza los golpes, la agresión física que sufrimos, pero también es el color de la lucha.	0
43277	Se han instalado bases terroristas en varios países, pero en general en zonas donde los gobiernos podían negar creíblemente tener control sobre ellas o donde estos realmente no lo tenían, tales como Yemen, Somalia y quizá Indonesia e Irán.	0
42211	La situación no resulta del todo adversa para Toledo.	0
40853	También creó la Autoridad Federal de Servicios de Comunicación Audiovisual (AFSCA), como órgano de aplicación y control.	0
40820	Le Parisien sostiene que “más allá del movimiento anti CPE, la juventud quiere hacer oír su voz”.	0
40139	Sin embargo, durante un gran operativo de todas las comisarías distritales el predio ubicado frente al Frigorífico Penta fue violentamente desalojado.	0
41779	El mundo de la Guerra Fría reflejaba cierta uniformidad entre ambas partes en la evaluación del riesgo.	0
42781	Los cazadores de brujas, en su mediocridad, creen que la presencia de la política en la base social envenena el medio ambiente, cuando en realidad es la única expectativa abierta para la democracia porque reconcilia a la gente común con las representaciones orgánicas.	0
43289	Ellos, que supieron ganar la confianza pública expresada en millones de votos, deberían saber cuál es la salida a las falsas opciones.	0
40290	Originalmente surgido de los femicidios, el lema también fue un trampolín a las tensiones en los cruces entre género y protesta social.	0
41061	Por un lado, los docentes pretenden aumentos salariales que se ajusten al avance inflacionario, como vienen reclamando, y por el otro, el Ministerio precisa de la colaboración de los distintos gremios para lograr completar los 180 días de clases.	0
41505	Ni los planes de austeridad ni el cheque de 2.500 euros por cada nuevo hijo ni la rebaja en los impuestos habían logrado frenarla.	0
40254	Después de todo, ¿para quién se hacían esos videos?	0
43253	Pero el terrorismo de hace dos décadas era de naturaleza diferente.	0
43280	Al despedirse de Fidel Castro, escribió: “Hasta la victoria siempre”.	0
41274	–El problema del Impuesto a las Ganancias sólo puede resolverse con una reforma tributaria integral que cambie la orientación de todo el sistema para que los que tienen más paguen más: hay que avanzar con impuestos a la renta financiera, a la extracción minera, a los terratenientes, a los grupos concentrados del sector financiero que especulan con transacciones en dólares y en ese contexto, resolver el tema del Impuesto a las Ganancias modificando las escalas y modificando las alícuotas para que sea definitivamente un impuesto que recaiga sobre los sectores que más ganan.	0
41968	Y era fácil, al mirar esas imágenes del sadismo de Hussein, suponer que los iraquíes estarían agradecidos con nosotros esta semana.	0
43311	Organizaciones sociales se manifestaron en diversos puntos del país para reclamar “por trabajo y salarios dignos para los trabajadores y trabajadoras cooperativistas, por una ley de emergencia efectiva y que termine con la precarización laboral, por igualdad para todxs los trabajadorxs y no para la baja de salarios”.	1
41987	La última vez que el vice, ahora convertido en presidente, fue a elecciones por las suyas obtuvo 99.000 votos.	0
40864	Y a su alrededor la gente asiente, se saluda con dos besos como es costumbre y pasan el domingo en el único sitio de esta ciudad desierta en el que el calor de la gente devuelve la vida al pulso ciudadano.	0
41425	La tradición se origina en Lisístrata, una pieza teatral del griego Aristófanes, donde las mujeres rechazan acostarse con sus hombres hasta que no termine la guerra del Peloponeso.	0
40926	JH: Esas son luchas entre imperialistas.	0
42283	"""Usted necesita enfrentar al enemigo de la mejor manera posible"", sugieren los organizadores a las mujeres patriotas en su sitio web."	0
40803	En estos frentes radica, sin duda, cualquier posibilidad de resistencia al programa conservador.	0
41667	Los antecedentes de Teresa Rodríguez de Neuquén (asesinada por la represión oficial aunque la bala fuera de un calibre distinto al de las armas reglamentarias) y los crímenes en Corrientes, aún impunes, que inauguraron la actual administración, más los cortes de ruta que se multiplican en el país, son huellas precedentes de un reguero que nadie sabe cómo puede terminar.	0
40713	El resto de los clientes va de los absortos en la pantalla que muestra la tribuna en el partido que Gimnasia le ganó a Boca a los que miran con franca desaprobación la variopinta humanidad que se va reuniendo.	1
43103	La microfonista Ariana Charrúa denunció, ante la empresa en la que trabaja, el acoso sexual que sufrió con el conductor radial Ari Paluch.	0
41794	“El conflicto empezó hace varios días, con la policía amedrentando con balaceras junto con gente de la compañía Tierras del Sud, piedras del lado de adentro, balas desde afuera –expresó Federico Vercelli, de la APDH–.	1
42157	Lo hizo recientemente en Irak.	0
40681	El caso Weinstein amplió la discusión sobre las diferentes formas de coacción y sometimiento que viven las mujeres para conseguir y mantener un trabajo, y para ascender en una profesión; en otras palabras, las condiciones de la brecha salarial, incluso en el star system.	0
42022	"""Queremos evitar que se pudiera politizar el tema pues la realidad es que la transparencia del proceso por el cual ha accedido la concursante Alejandra Lazzaro es la más auténtica garantía para su llegada, resultando esta profesional la de mejor performance."	0
41056	Proa 21 –coordinada por Santiago Bengolea– tiene dos pisos: el superior estará dedicado a una radio online “y otros proyectos que estamos delineando”, comenta Rosenberg.	0
42545	“Incluso había amenazado con el arma a otro pibe, pero tuvieron que esperar a que matara a alguien”, explicó ayer un joven que participaba del corte.	1
42019	Soy mapuche.	0
41530	El próximo paso estará en manos del juez Oyarbide y el fiscal Pollicita.	0
41003	"""Cuestionar eso es un acto de voluntarismo sin sentido, es criticar lo que no se puede criticar"", expresó."	0
41055	Más tarde, y después de estar desmayada y tendida sobre “una colchoneta sucia y húmeda”, Sánchez fue trasladada a la cárcel del barrio San Martín, la UP1.	0
40388	En tanto, varios enfrentamientos se registraron ayer en la zona donde, en la víspera, habían mantenido negociaciones emisarios gubernamentales y los rebeldes.	1
40208	"""La dirección del disparo y la distancia no corresponden con el lugar de la explosión del avión ni en la práctica ni en la teoría"", dijo y agregó: ""Todos los blancos de los proyectiles utilizados durante el ejercicio fueron registrados por los dispositivos correspondientes y se sabe que alcanzaron sus objetivos""."	0
43003	Su estrategia es demostrar que llegó con vocación de resolver problemas, para lo cual aspira a ubicar el diálogo en frecuencia técnica y sacarlo de la turbulencia política.	0
40884	Sin embargo, también concedió que “los argentinos el año que viene no vamos a dar un paso atrás si alguno de nosotros gobierna el país”.	0
41989	Aquí, los detalles.	0
40229	Ni contra la Policía ni contra el hombre que lo mató ni contra su familia porque Lucas no era así.	0
40049	“El chico que estaba con él dice que escuchó tres tiros y recién después Lucas encendió la moto y pudo irse.	0
42257	No sin dificultades se conseguían en librerías.	0
