id	text	label
43262	Hay que recordar que cuando se aprobó, algunos grupos de medios presentaron medidas cautelares para que no se ponga en vigencia el programa de adecuación.	0
41679	"El Estado argentino va a garantizar las fuentes de trabajo y el cumplimiento de una ley que democratiza la información en los medios de comunicación en la república argentina.7 D de diciembre, de diversidad, de Democracia""."	0
43255	Pero no vine a discutir marxismo con vos.	0
40196	Todos iban en bicicleta.	0
42331	Naidenoff había participado, junto con Amarilla, de una recorrida por la zona oeste de la provincia, junto con el equipo del programa Periodismo para todos, de Jorge Lanata, que también fue víctima de hechos de violencia en los últimos días.	0
41681	La última palabra sobre todo este conflicto la tendrá la Corte Internacional de Justicia, la autoridad judicial de las Naciones Unidas.	0
42820	Ese cambio despertó las sospechas de la Organización de Estados Americanos (OEA), que en un comunicado advirtió sobre cambio “drástico y difícil de justificar en la tendencia de los resultados preliminares”.	0
41265	"""José, tenemos que vernos urgente... Tengo noticias."	0
42099	En aquel momento no se cumplían ni diez años del fin de la dictadura de Videla y Massera, y estábamos en plena lucha por la Memoria, la Verdad y la Justicia.	0
42507	“En vez del pacto Roca Runciman, acá hay un pacto Moreno Cargill”, dijo ayer a Clarín el titular de Federación Agraria, Eduardo Buzzi.	0
41057	Las familias, en su mayoría parejas jóvenes con niños, habían iniciado la ocupación del predio el lunes en reclamo de una solución habitacional al intendente Martiniano Molina, pero el municipio negó que existieran problemas de vivienda en esos barrios pobres del municipio.	1
43162	El atentado en la redacción de la revista satírica francesa Charlie Hebdo, donde murieron 17 personas cuando un grupo comando terrorista ingresó a los tiros, no pasó desapercibido para los productores de Los Simpson, quienes homenajearon a las víctimas el domingo pasado en el episodio estreno de la temporada 26.	1
42168	Es imposible determinar sin embargo cuándo se cumplirá la condena, o siquiera si podrá cumplirse alguna vez.	0
41885	"""Sin embargo, la vida ha cambiado."	0
41326	"Pero no todo es culpa de la gente que vive allí, acá se trata de mafias que usurpan las viviendas y luego les cobran a las familias unos $ 200 mensuales por una pieza en la que viven diez personas hacinadas"", acusó Abatti."	0
43361	Los docentes bonaerenses cumplieron hoy con alta adhesión la primera jornada del paro por 72 horas que paralizó la actividad escolar en rechazo al descuento de los salarios, mientras que los padres de casi cuatro millones de alumnos de la provincia aguardan el cese del conflicto para reiniciar el año escolar el viernes próximo.	1
41902	Su centro se ocupa casi con exclusividad en la colaboración entre jóvenes israelíes, palestinos y jordanos.	0
41813	Maravilloso: Disney World.	0
41590	"""Es contra la distribuidora porque echó a un compañero y tiene personal que debe revistar en nuestro gremio"", dijeron."	0
43196	Pero, como ya ocurrió en el juicio al dictador Jorge Rafael Videla en 2010, la mayoría de los represores prefirió refugiar sus bravuconadas y supuesta valentía en una sala contigua con circuito cerrado de televisión no bien les tocó declarar a las primeras testigos mujeres: la abogada querellante Marité Sánchez, quien fue secuestrada el 24 de febrero de 1976, embarazada de siete meses y medio; y la Abuela de Plaza de Mayo Sonia Torres.	0
42769	La asamblea de anoche fue convocada en este contexto, para decidir entre tres opciones: no cortar (y cuidar así el juicio ante la Corte de La Haya), cortar por el fin de semana largo o iniciar un corte por tiempo indeterminado, dirigido no sólo a reclamar al gobierno argentino sino también a generar una presión sobre el gobierno uruguayo.	0
42674	La opción por los pobres es lo único que puede evitar que la Iglesia se convierta también en otro rehén del ajuste perpetuo.	0
42954	¡Los estadounidenses capturaron a su doble!” No pude encontrar a nadie que de veras hubiera escuchado esa grabación, pero entendí lo que significaba.	0
42355	"""Se duplicó el número de empleados que trabajará en la tarea de escaneo para que haya menos errores en los centros de trasmisión, con dos turnos de 1200 personas en cada uno"", agregó Fernando Álvarez, titular de la DINE."	0
41980	"El diario español El País trató el paro en su edición impresa de ayer con el siguiente titular: ""Una huelga de Aerolíneas desata el caos en el aeropuerto de Buenos Aires""."	1
41267	¿Qué provecho se le puede sacar a la actual crisis en los territorios palestinos si los estudiosos esquivan la investigación conjunta con colegas israelíes, expulsan a los profesores israelíes de los consejos de las publicaciones y rechazan invitaciones para visitar Israel?	1
41977	"""Le exigimos a la señora presidenta el esclarecimiento del caso, no puede quedar impune"", dijo Rodolfo Arrechea, de ATE Capital."	0
43022	Terrorismo de Estado era la ESMA, cuando torturaban y mataban.	0
43373	En el marco de esa política gubernamental se lanzó en octubre de este año el programa Enamorar, que se define en su portal como “la primera política pública orientada al fomento de los valores centrados en el amor”.	0
42720	La verdad es que no le encuentro razón ”, dijo por radio cuando le preguntaron por el policía Gonzalo Kapp, que quedó detenido y a disposición de la Justicia de San Nicolás.	0
41898	"""Quisimos buscar un restaurante donde no hubiera mujeres atendiendo ni cocinando."	0
42835	Recuerdo el ataque en Campo de Mayo, al vivac del Regimiento 2 de Infantería, así como el diario ataque a policías para apoderarse de sus armas.	1
43138	En estos días se encaminaban a devorar totalmente un país sobre el cual Riad siempre ejerció influencia.	0
41817	En el Ministerio de Economía, que dirige Felisa Miceli, los voceros confirmaron que se analizan técnicamente diversas alternativas -elevar el mínimo no imponible, ampliar las deducciones al salario o una combinación de ambas- y el impacto fiscal de cada una de ellas.	0
41641	“¡Sigue con nosotros!	0
42989	La información fue confirmada a la agencia DyN por José luis Matazza, secretario de comunicación de ATE-nacional.	0
40108	Según su vocera, la decisión no obedeció a la crisis global sino a una parada de rutina para mantenimiento.	0
40848	"""El abogado del señor me comunicó hoy que había recibido una amenaza hace veinte días y que eran de un número (telefónico) privado, de una voz de sexo masculino, y por un breve período de tiempo"", precisó la jueza."	1
41323	Días después de esa presentación, la Asamblea de Dique Luján y Villa La Ñata mantuvo una reunión con el secretario de gobierno del municipio, Mario Zamora, y las funcionarias de ambiente y desarrollo territorial; además de un grupo de concejales del Frente Renovador y de UC.	0
41567	Además, fue establecido un sistema de subsidios a los molinos harineros, para que no terminaran pagando por el trigo el mismo precio en dólares al que cotizan en el mercado internacional.	0
40937	Aparece un préstamo de 62.000 millones de euros.	0
40781	Pero la nacionalidad es muy diferente al Estado.	0
40802	Muchos de los cuerpos están desfigurados y por lo mismo es difícil identificarlos de inmediato, según un funcionario del estamento de seguridad.	0
43203	Minutos después del aviso llegaron al lugar efectivos de la comisaría 16a.	0
43394	EE.UU.	0
42305	De paso, cultivó el periodismo al escribir en los diarios locales.El futuro santo mostró allí una personalidad alegre, emprendedora y apasionada, además de un claro compromiso con la formación de los chicos y jóvenes.	0
40985	Según las autoridades del estado mexicano de Baja California, antes de la llegada de la caravana ya se contabilizaban cerca de 4000 personas que llevan meses esperando turno para pasar por la estación migratoria estadounidense.	0
42843	Cuatro días antes de la Navidad de 1956, vuelven a verse en la Sierra Maestra.	0
41537	Según un estudiante, la matanza comenzó tras una pelea del asesino con su novia por una supuesta infidelidad.	0
40836	Si bien Ucrania desmintió que un misil suyo haya impactado contra el avión, sí confirmó la existencia de maniobras militares en Crimea, en la localidad de Cabo Onuk, a unos 250 kilómetros de donde cayó el Tu-154, un territorio controlado por la flota rusa del Mar Negro.	0
41551	Por la ley aprobada en el Congreso, cada grupo empresario puede operar como máximo en el país, 24 licencias de TV por cable y 10 de las denominadas abiertas, radios AM, FM o de TV abierta.	0
40907	"""Superamos nuestras expectativas en cantidad y en calidad"", aseguró Florencia Herrera, encargada de Comunicaciones de la compañía finesa en Uruguay.Según relevamientos de la organización Greenpeace, las treinta pasteras argentinas --por cuyos efluentes ya ha protestado el gobierno de Paraguay-- apenas llegan a las 900 mil toneladas anuales."	0
41984	Las imágenes de la página del Ejército Argentino intervenida con supuestos mensajes del EI fueron difundidas en las redes sociales.	1
41101	"La información fue proporcionada a DyN por el secretario de prensa de Foetra, Sergio Sosto, quien aseguró que el gremio reclamó un ""25 por ciento de aumento de sueldos de sus afiliados calculado sobre los básicos de convenio"" que rigen esa actividad."	0
42202	“Esa situación pondría al Estado argentino en un mejor contexto frente a Irán y la comunidad internacional para exigir la extradición o al menos para negociar la realización del juicio oral en un tercer Estado –agrega–.	0
41368	El de la terquedad del presidente deriva peligrosamente hacia un baño de sangre.	0
42208	Su actuación en 2011, cuando le impuso más del 90% del total de multas del organismo, es una clara demostración de este trato discriminatorio y persecutorio.	0
42171	“Esa propuesta va a ser parte de una construcción colectiva, ninguno de los actores va a imponer su postura porque eso es antidemocrático”, prometió.	0
40458	La imagen mostraba a jóvenes que aparecían detrás de una pared para lanzar bombas de petróleo, mientras que se veía a un grupo de hombres usando armas de fuego caseras.	1
42278	El ofrecimiento fue presentado por el director de la oficina del primer ministro Dov Weisglass en reuniones realizadas en los últimos días con la consejera del presidente estadounidense George W. Bush para la seguridad nacional, Condoleezza Rice.	0
41309	Pero luego ajustaron el reclamo y lo limitaron a los cinco choferes que están a cargo de los móviles afectados a la distribución de diarios.	0
40383	Una tardanza de dos días complica los planes.	0
43035	De este modo, el sistema internacional basado en el estado-nación soberano está siendo transformado por una amenaza transnacional que debe ser combatida en el territorio soberano de otros países por cuestiones que trascienden al estado-nación.	0
41886	A diferencia de lo que ocurría en la época del Tratado de Westfalia, cuando el movimiento de ejércitos anticipaba la amenaza, la tecnología moderna al servicio del terrorismo no da aviso, y sus responsables desaparecen en el momento de cometer el acto.	0
41401	Los vecinos contaron que los sacaron envueltos en frazadas de pies a cabeza.	0
40580	La promesa del gobernador de anunciar hoy un cronograma de pagos no alcanza a poner un paño frío sobre el ánimo de la gente (ver aparte).	0
42951	Tras caminar centenares de kilómetros, pasaron la última noche de su peregrinaje durmiendo en micros que los dejaron a un costado de la caseta de peaje de Tijuana.	0
42054	Un chico, con glitter y una encantadora sonrisa, le abre paso y le pregunta si va a entrar.	0
42867	En las calles se escucha una consigna reiterada: cobrar los sueldos.	1
43404	"Que el artículo 68 de ese curioso texto afirma sin ambages que ""se prohíbe el uso de armas de fuego y sustancias tóxicas en el control de las manifestaciones pacíficas"", pero el 11 de abril último una veintena de personas desarmadas e indefensas fueron asesinadas por esbirros al servicio de Chávez, y otro centenar resultaron heridas -crímenes que el gobierno se niega a investigar a fondo-; ola de violencia que ha continuado con el secuestro político, violación y tortura de una conocida actriz, el allanamiento ilegal de las casas de muchos opositores y el creciente matonismo callejero de los ""círculos bolivarianos"", versión chavista de las camisas pardas hitlerianas o de las ""brigadas de respuesta rápida"" de la dictadura cubana."	0
41148	Pasé 24 horas mirando una y otra vez esos videos.	0
42623	Reclamos A favor de retomar los bloqueos habló Jorge Fritzler, con la propuesta de interrumpir el tránsito desde el viernes a las dos de la tarde hasta el domingo hasta las 18.	0
40035	“Yo vengo en defensa de los derechos del colectivo, que los veo en peligro.	0
42221	Pedro de Mendoza 1929.	0
40619	Ocurrió en Esquel, donde Jones Huala está detenido.	0
42241	"Algunos se aprovechan de un grito genuino para confundir y generar conflicto"" Cecilia La Porta 34 años ""Vine con mis hijas para reclamar por una educación libre, sin juegos sexistas que limiten y coarten su libertad."	0
41804	Se hicieron presentes el jueves 16 en el Edificio Centinela, asistidos por técnicos informáticos.	0
40565	La huelga de tres días de los trabajadores del personal de mostrador de Aerolíneas Argentinas-Austral, que dejó a más de 17.000 pasajeros varados en el Aeroparque Metropolitano Jorge Newbery, no sólo afectó a viajeros argentinos.	1
42901	Al día siguiente, un comando entró en el hospital de urgencias donde estaba operando a un paciente y se lo llevaron esposado.	0
40147	Ellas se cargaron la lucha al hombro”, insiste.	0
41084	cerca de la Plaza de la Revolución en el centro de Teherán.	0
41913	“La medida es en rechazo al achicamiento, despidos y la persecución sindical que atraviesa al sector aeronáutico”, aseguró Brey a Página/12.	1
42412	"""Hoy, paramos"", anunció en su casa."	1
41123	Y así lo dice:Seguramente he cometido muchos errores.	0
41066	Sus hijos de 14, 12 y 7 años la miraban atónitos.	0
41208	Frente a una situación , la policía de la ONU se retiró del norte de Mitrovica, dividida étnicamente entre los serbios que pueblan esa parte de la ciudad y los albaneses que viven en el sur.	0
40393	Los consejeros dispusieron por unanimidad promover una discusión amplia al interior de los tres secundarios que serían alcanzados por la medida: los dos en conflicto y la Escuela Agrotécnica.	0
40996	Terminaron pegándole cuatro tiros en la espalda, después de que él alcanzó a sacar el arma y descargarla contra los agresores.	0
42378	"LO QUE DICE EL GOBIERNO""Pero hagamos un poco de historia."	0
42815	Algunos sitios de Internet de partidarios de Mousavi propusieron protestas callejeras, pero el candidato no hizo ningún anuncio.	0
40188	"""El pueblo de Irak está en una gran miseria y se opone a la ocupación"", dijo Sheij Abdul Karim Paz, representante de la Organización Islámica Argentina."	0
40550	Como muestra de este clima ríspido que se vive en Bolivia, el vicepresidente del Tribunal Supremo Electoral, Antonio Costas, presentó su renuncia “irrevocable” debido a la “desatinada decisión” con la que el órgano electoral difundió unos resultados preliminares, según explicó.	0
41417	Tuvo a su hija esposada a una cama de un hospital.	0
40036	Finalmente, los remataron con pistolas y hasta de un mazazo.	1
41592	Al día siguiente, la jueza de Zapala Ivonne San Martín hizo lugar al pedido de la petrolera y ordenó notificar a la comunidad que permita correr alambrados y tranqueras para el paso de la compañía.	0
43421	Desde el micrófono, una de las primeras cosas que recuerdan es que no hay que caer en las provocaciones (que va a haberlas) y que a las agresiones hay que responderles con amor y buena onda.	0
40107	Será en Ginebra.	0
40429	"Desde el Ejército informaron a través de un comunicado oficial que sólo su sitio web ""sufrió una agresión de seguridad informática""."	1
41536	El escándalo fue tan grande que hasta el oficialismo debió sumarse al rechazo social.	0
41240	Sobre él, también, opinó la ministra de Seguridad Patricia Bullrich.	0
41651	Apenas se conoció el crimen, Galarza declaró como testigo y dijo que había visto por última vez a su ex novio la noche anterior, pero horas después la joven se presentó ante la Justicia y confesó haber cometido el homicidio.	0
42594	Ambos colocaron unos 40 legisladores en los comicios de junio y se oponen a que Bolivia exporte gas a EE.UU.	0
41519	En las PASO de agosto hubo 397: 80 de los nuevos se instalaron en el conurbano.	0
42495	El abogado Julián Alvarez llamó a los mapuches “delincuentes que viven en la ilegalidad”.	0
42428	Y convocaron a concentrarse hoy.	0
41181	Y, sobre todo, luego de los violentos incidentes del martes pasado en Constitución, cuando usuarios enardecidos por las demoras del servicio quemaron la boletería y la comisaría de la estación.Pese a las quejas de los usuarios por el servicio, el Gobierno paga al Belgrano Sur un subsidio promedio de $ 6 millones por mes y al Roca $ 12 millones.El apuro del Gobierno por resolver esta crisis es tan evidente que mañana mismo la UGOFE se hará cargo de la operación en estos dos ramales que quedaron vacantes.	1
41755	‘Pensá bien lo que vas a decir por lo que tenés ahí adentro’”, la amenazaron.	0
40238	Otro punto sobre el que llama la atención el texto es que en esos documentos “Nisman ‘no sólo no hace ningún tipo de alusión a la inminente o consumada presentación de la denuncia en contra de las máximas autoridades del Poder Ejecutivo Nacional”, sino que además “presenta una postura diametralmente opuesta, en el sentido de que realiza consideraciones sumamente positivas de la política de Estado del gobierno nacional, desde 2004 hasta la actualidad’”.	0
41237	Asimismo, se prevén dos tipos de tarifas: una progresiva, para las zonas en que se busca que haya mayor rotación de vehículos, de manera que aumentará el valor a medida que transcurran las horas; y otra simple, en la que el monto de la tarifa será constante, sean cuantas fueren las horas de estacionamiento.	0
40716	El martes ya habían intentado ingresar al predio, pero fueron repelidos con hondas de revoleo.	0
42913	"Somos socios, no competidores"", dijo."	0
40367	"En declaraciones a Radio América, señaló que ""hay una voluntad política del Gobierno de modificar la base no imponible de Ganancias desde antes de los hechos ocurridos en Santa Cruz""."	1
41839	La situación cobró tal grado de violencia que obligó un día después al Gobierno a dejar sin efecto la medida y, además, a retirar del Parlamento el presupuesto general que había enviado días antes de los disturbios.	1
41398	El quiebre del Bankia, creado con lo que quedaba de las cajas de ahorro regionales, encendió todas las alarmas.	0
42309	El de ayer no fue un día más.	0
42726	El incidente se registró a las 4 de la mañana, enfrente de la casa del líder de los concejales radicales de la capital formoseña y también mereció la intervención del presidente del comité nacional de la UCR, Ernesto Sanz.	1
42633	"""Es muy duro lo que estamos pasando."	0
41966	En el acto de la Plaza de Mayo, la Presidenta se había referido a ellos como “los cuatro señores a quienes nadie votó”.	1
40038	Sin duda, la atribulada transición egipcia entró en su fase más turbia y peligrosa.	0
41012	Desde el 2008, el PBI se viene contrayendo como un molusco.	0
40389	Pero una afinidad que está también fuertemente motivada en el profundo temor de que las críticas públicas contra el gobierno de Sharon se ganen la ira de los norteamericanos de origen judío en las próximas elecciones y el cargo de ser anti Israel o, lo que es peor, antisemita.	0
40160	Los análisis de balística indican que una de las armas fue usada en ambos tiroteos.	0
42032	En La Paz también hubo momentos de tensión.	0
41727	Se trata del beato Héctor Valdivielso Sáez, un hermano lasallano que en su vida religiosa adoptó el nombre de Benito de Jesús y que murió mártir en España.	0
40786	Los agresores usaron guantes, eran varios y se llevaron las armas, algo que no encaja con la idea de, por ejemplo, desquitarse de alguien que mantuvo una relación con la esposa de un preso.	0
43169	Después del sepelio, un grupo de jóvenes pidió justicia en el Centro de la ciudad.	1
41209	Ruzack intercambió unas palabras y empezó a forcejear con el ladrón.	0
40639	“Como es público y notorio, la entidad que usted preside, junto a las demás entidades rurales, ha decidido poner fin al paro de comercialización de granos oportunamente dispuesto y ha dispuesto el levantamiento de los diversos cortes de ruta que en los últimos cien días se habían expandido en determinados lugares del país.	1
42811	"Tras la cordillera En Chile, el matutino El Mercurio, también dedicó espacio al conflicto gremial de los empleados aeroportuarios: ""Una huelga de trabajadores de tierra de las empresas Aerolíneas Argentinas y Austral en el Aeroparque Metropolitano de Buenos Aires, en protesta por agresiones sufridas a manos de enfurecidos pasajeros, provocó ayer demoras en los vuelos."	1
40617	Los sauditas también necesitan a los huties para que el país no acabe en un abismo de fanatismos.	0
42732	Sólo un incidente causado por un tercer actor podría abortar la primera reunión que mantendrán la semana que viene en Ginebra funcionarios de las cancillerías de Irán y la Argentina, confió a Clarín una alta fuente diplomática.	0
42153	El texto señala que los vecinos tendrán que “acostumbrarse” a convivir con la planta de celulosa.	0
43184	Durante la tortura le habían marcado una esvástica en el pecho.” A Marité le pegaron delante de él: “Me agarraron de los pelos y me dieron la cabeza contra la pared.	0
41725	La semana próxima, está previsto que se realice el peritaje psiquiátrico a Galarza e incorporar a la causa el informe final de la autopsia, el balístico, el de los teléfonos y tomar testimonios a amigos de la víctima, tras lo cual el expediente sería elevado a juicio.	0
40730	Una de ellas es que el presidente, Jacques Chirac, devuelva el texto al Parlamento para su debate.	0
40818	Desde el Partido Obrero no parecieron tomar muy en cuenta esas hipótesis.	0
41914	Aún no hubo respuesta y el juicio comenzará el lunes en Zapala.	0
42492	“Nuestra gente reconoce que junto a la policía vino gente de la estancia, porque se conocen, son de la zona y los pueden identificar”, agregó.	0
42921	JL: Con lo que decís vos estás de acuerdo con el ISIS, que hizo el atentado en Barcelona.	1
41042	Embistió en la noche un acoplado que cortaba la ruta 136.	0
40413	"""Ahora vamos a vivir la tensión del crecimiento; no hay que alarmarse, es parte de la democracia"", agregó el Presidente."	0
40748	"""La única verdad es la realidad"", dice la vieja enseñanza aristotélica que aquí se popularizó durante el peronismo."	0
42841	El único compungido en Cannes era Luis Pedro Toni, confeso menemista.	0
41442	La mañana del 23 de enero de 1993, cuando en este mismo diario leí el artículo de Osvaldo Bayer titulado “Matar al tirano”, en el que recordaba los 70 años del atentado en que el anarquista alemán Kurt Gustav Wilckens mató en el barrio de Palermo, de un bombazo y cuatro tiros, al coronel Héctor Benigno Varela, fusilador de peones rurales en la Patagonia, sentí que debía responderle.	1
41905	“La prioridad no puede ser el tren bala, sino un plan de recuperación de la soberanía ferroviaria.	0
42400	No obstante, se intentó al principio que la Justicia procurara parar los actos terroristas, creando una Cámara y poniendo al frente a un juez capaz y valiente, el doctor Quiroga.	0
41220	Hay edificios que se convirtieron en casos emblemáticos.	0
41051	Fueron seleccionados el martes pasado por las partes y el juez Raúl Aufranc.	0
41680	"El intendente de la localidad puntana de La Calera, Diego Lorenzetti, le dijo a la jueza que investiga el crimen de su mujer que antes del asesinato recibió “amenazas graves” vinculadas a su ""actividad política"" pero que no había radicado la denuncia."	1
41130	En su discurso en cadena nacional, poco antes de que Gerez apareciera, el presidente Kirchner había acusado a bandas parapoliciales y paramilitares de estar involucradas en el caso.	0
40223	Es que para Néstor Kirchner no se trata de un episidio traumático más, sino de un hecho grave, sucedido en su provincia natal, que debe resolverse conforme a derecho.	1
42156	"Uribe se va a agachar a los pies de Bush pidiendo el tratado de libre comercio y no se lo va a dar"", dijo el taxista Felipe Rodríguez mientras intentaba abrirse paso en una ciudad custodiada por más de 21.000 agentes de seguridad."	0
43139	Los chicos si bañar, sin comer, desorden por todos lados, ropa tirada, caca del perro.	0
41096	No podemos pasar por alto las desafortunadas expresiones del ministro de Justicia.” También hubo críticas desde la CTA.	0
42808	En respuesta a las asambleas, Aerolíneas Argentinas canceló los vuelos a Santiago de Chile, Rosario, Mar del Plata y a Posadas.	1
41198	En el Gobierno esperan que la menor cantidad de partidos que competirán en octubre, producto del filtro de las PASO, también agilice la carga de datos.	0
42203	Que no había ningún bebé.	0
43264	Palazzo era, cuando secuestraron a Di Toffino, nada menos que el gerente de personal de la EPEC.	0
41465	No en balde fueron convocados de urgencia el arzobispo de Salta y el obispo de Tartagal para evitar las reincidencias violentas.	0
