id	text	label
41363	Hartos de la crisis salieron para decir “no somos marionetas de políticos y banqueros” y pedir “¡Democracia real, ya!”.	1
43160	Allí fueron obligados a colocarse delante de una zanja abierta el día anterior y el pelotón abrió fuego.	1
41521	Al costo, incluso, de que su contraparte Rohani se erosione bajo la morsa de sus enemigos internos que meditan como los republicanos sobre estos acuerdos.	0
42174	De los 15 heridos, 12 siguen en el hospital en condición estable.	0
41895	En lugar de divertirse apretando a los medios no adictos, debería tomarse en serio el descalabro cambiario.	0
42661	Aunque todas las encuestas hayan pronosticado que, de haber participado, de todas formas habría enfrentado una derrota.	0
41564	"A la vez que centró el comentario en ""la falta de información que sufrieron las 10.000 personas afectadas""."	0
42117	[email protected] [email protected] participaron, opinaron y tomaron partido al calor de aquella polémica que ninguno de los dos quería cortar, pero cortó el entonces director del diario.	0
43325	"El periodista iraquí Muntazer al Zaidi, quien el domingo arrojó sus zapatos al presidente de Estados Unidos, George Bush, en Bagdad, fue duramente golpeado desde su detención, denunció ayer su hermano a la cadena pública británica BBC.Al Zaidi, reportero de la cadena Al Bagdadia, tiene una mano y varias costillas rotas, hemorragias internas y una herida en un ojo debido a los golpes que recibió tras ser detenido, aseguró Dargham, su hermano mayor.El periodista, de 29 años, fue arrestado instantes después de lanzar sus zapatos a Bush y gritarle ""perro"", mientras el mandatario, de visita sorpresa para despedirse de Irak, daba una conferencia de prensa junto al premier iraquí, Nuri al Maliki."	1
42560	Contra ella que se esconde atrás de él y él que la cubre con un manto de indefiniciones.	0
42898	Charles Steger, presidente de la universidad Virginia Tech, confirmó en declaraciones a la prensa que el hombre armado con dos pistolas que fue hallado muerto en una de las aulas de la universidad luego del tiroteo, era un estudiante de origen asiático que residía en la universidad.	0
42805	En total, Igualdad Cultural tuvo este año un presupuesto de 115 millones de pesos.	0
40992	Las facciones pro y anti Mursi se acusaron mutuamente de haber salido a matar.	0
42266	"Los 51 miembros de la junta de gobernadores de la Academia aprobaron por unanimidad una serie de reformas en la noche del jueves último, para ""empezar el proceso de cambiar significativamente la composición de nuestra membresía'', dijo Boone Isaacs, después de un aluvión de críticas que duró una semana y exigencias de un boicot a la ceremonia de entrega de los premios Oscar debido a la falta de diversidad entre los nominados."	0
42165	Ayer se informó que la Junta Electoral aplazó hasta el próximo fin de semana la publicación oficial de los resultados, que estaba prevista para hoy.	0
43288	"""Hoy decidí no hacer nada de lo que hago a diario en casa por ser mujer."	1
42499	--preguntó Clarín a la portavoz de la empresa.--Botnia funciona en un Estado de derecho y acataría cualquier decisión.	0
40849	En Estados Unidos, los políticos de todos los partidos estuvieron bregando por afirmar su apoyo a Israel.	0
42447	No hay apoyo en la costa, sí una celada.	0
42386	Pero las rupturas no han sido pocas, ni poco significativas.	0
42085	Sumaron registros fílmicos que durante el fin de semana tuvo en sus manos el gobierno.	0
42350	La suerte está echada.	0
42694	Pero Washington decidió suspender su decisiva asistencia aérea y demandó que las fuerzas amparadas por Teherán se retiraran a la retaguardia.	0
41786	El último año, el Departamento de Agricultura de EE.UU.	0
41606	En parte por lo que pasa a diario en el Conurbano es que la inseguridad está al tope de las preocupaciones de los argentinos en todas las encuestas.	0
40280	La actividad escolar fue prácticamente nula en el sector público y se desarrolló con normalidad en los colegios privados, mientras que hoy se apostaba a que el viernes próximo los alumnos bonaerenses podrían reiniciar la segunda mitad del año escolar, tras un mes y medio sin clases.	0
40298	El estado de sitio fue un error gravísimo-, dice, por fin.Recuerda, ahora, los momentos más convulsionados.	0
43084	Los más afectados serán Almagro, Caballito, San Cristóbal, La Boca y Villa Crespo, donde hoy casi no hay parquímetros y que, si se aprueba la ley, tendrán prácticamente toda su superficie bajo el régimen de estacionamiento medido.	0
41777	Ante esa postura la Corte Suprema pareció creer con su fallo del miércoles 3 que todo daba lo mismo.	0
42826	Ayer, en su primera aparición pública tras una semana de grandes protestas contra el resultado oficial de los comicios del 12 de junio, el guía supremo iraní, ayatollah Alí Jamenei, exigió en duros términos el fin de las manifestaciones callejeras que reclaman un nuevo proceso electoral y ratificó la reelección del presidente ultraconservador Mahmoud Ahmadinejad.	1
42077	Sharon no es amigo del enfoque crítico y académico frente a las cosas.	0
42260	"EL CAIRO.- Egipto suma cada vez más tensión e incertidumbre a su agitada vida política más de un año después de que la ""primavera árabe"" acabara con el gobierno del dictador Hosni Mubarak e iniciara una transición que llevaría, supuestamente, hacia la democracia."	0
43384	Sin embargo, el malestar entre los amigos del chico asesinado iba más allá de la responsabilidad puntual de Kapp y señalaban que se sabía que esto podía pasar y no se paró a tiempo.	0
41007	Mantuvo contacto permanente con los enviados del Gobierno nacional a su provincia.	0
42493	Participaron de la votación unas quinientas personas.	0
40064	La información fue difundida por la agencia católica AICA, que informó que el santo nacido en la Argentina será canonizado por Juan Pablo II en octubre, junto con otros nueve españoles asesinados por grupos marxistas en la revolución de Asturias, en 1934.	1
41053	El proyecto demandó una inversión de 1.200 millones de dólares.--¿Qué pasaría si la Corte de La Haya determina que Uruguay incumplió compromisos previos con Argentina y el gobierno uruguayo se ve obligado a pedirles que levanten todo?	0
40706	–A mediados de mayo, el ministro de Economía había pedido “racionalidad” a las exigencias de los gremios.	0
42571	"""Ministro!"	0
40174	Finalmente leyó un discurso que respetó un delicado equilibrio, para el que tuvo un aporte especial: había recibido un llamado del presidente Fernando de la Rúa, quien, además de saludarlo, le explicó en detalle el por qué del beneficio a los condenados.	0
41026	Tanto desde la oposición como desde sectores internos del Gobierno reclaman que el controvertido funcionario sea separado de su cargo.	0
42013	Un policía que estaba de guardia alcanzó a detener a dos atacantes.	0
42960	Tenían miedo de que les sacaran las motos, así que intentaron irse antes”.	0
42027	El avión iba de Tel Aviv a Novosibirisk, en Siberia, agregó el vocero.	0
42258	Si las paritarias se discuten en una franja que está cercana al 30 por ciento, está claro que se está discutiendo por encima de la inflación e incluso se están recuperando los cuatro puntos que se perdieron el año pasado.	0
42882	La hace a su modo, con su estilo, ese del que no puede escapar ni en el helicóptero, ese modo de ser, cansino, de hombre entre parco y distraído.	0
43275	Este tipo de centros atañen a las últimas relaciones entre pueblos que debieran ser interrumpidas, a pesar de las circunstancias políticas.	0
42603	La secretaria de Integración Regional, María del Carmen Alarcón, no asistirá.	0
42916	"Si los padres de un venezolano recién nacido deciden llamarlo, por ejemplo, ""Napoleón Bonaparte González"", ¿se trata de un nombre propio o ajeno?"	0
41573	En los grupos que pertenecen a “la resistencia” están los que además exigen la cabeza de De Villepin.	0
41897	"Aguante Racing"" ."	0
41471	Si el diálogo termina con éxito, la teocracia persa consolidaría su influencia en ese espacio estratégico y posiblemente también la incrementaría.	0
42113	Aquel día no se tomó ninguna decisión “para pensar mejor las cosas”; había un clima poco favorable al piquete.	0
41934	De la Rúa hace tiempo que se vio obligado a retirarse de la política y de casi todo, hace años que no da clases en la facultad, que no participa de ninguna discusión política, que no es invitado a los actos públicos ni a los canales de televisión, hace años que los productores radiales no tienen sus nuevos números de teléfono.	0
40205	Es posible que ésta sea la máxima ironía ya que la tarea del traductor consiste en trasladar la mente de un pueblo a la de otro dentro del complejo mundo actual.	0
42108	JL: Pero está garantizada por la Constitución.	0
40484	¿Por qué nunca logró probarla en la justicia?La conspiración se probó en la Justicia, hay pruebas de sobra.	0
40880	El bombardeo que Arabia Saudita, al frente de una coalición de una decena de países árabes, ha iniciado sobre esos insurgentes shiitas cercanos a Teheran, tiene un doble significado.	0
41925	Pero ya no”, dijo con dureza.	0
42558	Recuperación del territorio de tierras productivas y sagradas para trabajar.	0
41344	"La ""acción preventiva"" El reto que plantea Irak no es el exacto grado de su relación con Al Qaeda —aunque Irak ha utilizado el terrorismo contra sus vecinos, contra Israel e incluso contra la lejana Europa—."	0
43316	El tantas veces nombrado Tango 01 no es una aeronave económica para realizar este tipo de vuelos internos, tratándose de un birreactor capaz de realizar vuelos intercontinentales y dotado de la última tecnología.	0
40246	Su función principal es auxiliar el trabajo de entrecruzamiento a los fines de una mejor investigación criminal judicial”.	0
43371	Ya entonces eran fama su indoblegable postura ética, su caudalosa competencia de historiador, su prosa apasionada.	0
43317	Entonces, resulta incomprensible que estos dirigentes sindicales convoquen a una medida de fuerza como si estuvieran enfrentando a un Gobierno que hubiera reprimido al movimiento o condicionado la libre discusión de los salarios.	0
42519	Esto ubica la tasa semestral de homicidios en 2,9 cada 100.000 habitantes.	0
42420	"""Será un placer para mí seguir trabajando con usted para derrotar a los terroristas"", dijo Bush."	0
41081	Desde nuestro punto de vista, ponemos entre signos de interrogación la idea de que esta derecha traiga demasiadas novedades.	0
43096	Las continuas manifestaciones podrían desencadenar una represión sangrienta o debilitar más al gobierno si no cumple sus amenazas de tomar represalias, pero si la oposición acata las advertencias oficiales, podría dar al gobierno los recursos que necesita para neutralizar el mayor desafío interno a su autoridad desde la Revolución Islámica de 1979.	0
40736	dice estar dispuesto a negociar, pero también se refugia en las disposiciones de la Organización Mundial de Comercio (OMC), que asegura cumplir.	0
40382	JL: ¿Cómo sabés que tus títulos son válidos?	0
41231	Remarcó la injusticia de que ninguno de los derechos de los pueblos originarios se cumple y detalló lo que hay detrás del juicio: “Este juicio implica garantizar a las empresas extractivas su accionar, poniendo el aparato judicial a su disposición para que los pueblos originarios no seamos un impedimento en sus proyectos extractivos”.	0
42172	Las estadísticas que exhibe el Gobierno señalan que, en los primeros seis meses del año, los homicidios disminuyeron un 19%.	0
40499	Y avanza con su aprendizaje, la lección de un país que pierde el “patriotismo” apenas se arrima al abismo, que se deja arrastrar por las ambiciones canallescas del poder.¿Sigue pensando que hubo una conspiración en su contra?	0
40856	La multisectorial que acudió al Congreso esta semana, con la CTA y la CGT disidente a la cabeza, es otra expresión de frentes de lucha, aunque el Presidente y el ministro de Economía no acudan a sus coloquios.	0
40957	Por el otro, se suspenderán por dos años los desalojos de los edificios públicos ocupados que dependen del Gobierno de la Ciudad, y se firmarán convenios con la Nación para lograr lo mismo en las propiedades públicas nacionales que queden en Capital y se encuentren intrusadas.	0
41072	El mandatario provincial admitió haber dado la orden para despejar la ruta en la que protestaban los docentes, medida que desencadenó la violenta represión que provocó la muerte de Fuentealba.	1
41468	Bueno, eso que se llama “recuerdo” se amplía con otros aportes del colectivo.	0
40287	Las amenazas y hostigamientos contra los mapuches se mantuvieron de manera reiterada.	0
40602	Cablevisión opera a través de 158 licencias locales, muchas menos que las 2.200 que cubren DirecTV, Telefónica o Telecom, en un caso de abierta discriminación.	0
41661	En esta vertiente también se buscan elementos.	0
40384	La oportunidad del ataque sobre Yemen se explica en parte por la coyuntura.	0
41610	La violencia y la tensión siguen aumentando en Teherán, donde la Policía local reprimió hoy brutalmente las manifestaciones callejeras.	1
42625	"""El sistema no se deja intimidar por esas iniciativas."	0
41728	Al no tener un territorio que defender, los terroristas no están sometidos a las amenazas disuasivas de la Guerra Fría; al tener como objetivo la destrucción de la cohesión social, no están interesados en los procedimientos de conciliación y las concesiones de la diplomacia tradicional.	0
42749	El origen del odio La semilla que culminó en la bomba de Oklahoma City fue plantada en el mortífero asedio de 1993 a un grupo militante rebelde en Waco, Texas.	1
42751	Con todo, de todos los actos de tonto prejuicio que florecieron en nuestro febril clima de verano, pocos estuvieron cerca del movimiento de cientos —o algo más de miles ahora— de académicos europeos que boicotearon toda cooperación con las universidades e instituciones letradas israelíes.	1
42183	Se supone que en el año 2000, la SIDE gobernada por De la Rúa pagó 5 millones de dólares de coimas para conseguir una ley en el Congreso (Ver Su última...).	0
41631	Una de las piedras dio en el rostro de Pelayes y le ocasionó la rotura del tabique.	0
41753	Un ejemplo poco conocido es el caso de la guerra angloboer, donde 25.000 mujeres y niños fueron encerrados en campos de concentración, y murieron 20.000 por diversos motivos.	0
41916	Las autoridades argumentan que creyeron que los primeros asesinatos eran un caso aislado.	0
40563	Y fue transmitido en el programa Periodismo para todos, que conduce Lanata por El Trece.	0
40113	Ayer, luego de que las entidades levantaran los cortes de ruta por el envío del proyecto al Parlamento, el Gobierno repitió otra vez la misma mecánica.	1
43095	"La jueza opinó que ""el tema de las comunicaciones puede ser determinante, o muy importante para abonar alguna de las hipótesis en las que se está trabajando""."	0
40142	En tanto, Morales, que no apareció en público desde que el domingo a la noche se proclamó ganador, anunció que se presentará hoy ante los medios.	0
43166	Preguntas que encierran una posición: no se llega al futuro caminando para atrás ni encandilándonos con el presente.	0
42315	En el Gobierno ratificaron la denuncia y el propio Fernández la repitió en declaraciones radiales.	0
40657	Los jefes de las bancadas acordaron con el Ejecutivo que ratificarán la resolución 125, que impone retenciones móviles según la variación del precio internacional, aunque también sancionarán leyes complementarias para atenuar el impacto de aquella medida sobre los pequeños productores.	0
43020	Junto a Moyano y De la Sota, aseguró que la Presidenta y el intendente de Tigre “son lo mismo”.	0
41068	Realizarlos significa, para el Alto Comisionado, que “los Estados deben adoptar medidas positivas para facilitar el disfrute de los derechos humanos básicos”.	0
42225	Las muertes desataron una inmediata reacción política.	0
41424	"En ese medio periodìstico se anunció: ""Los aeropuertos argentinos siguen estando en el ojo de la tormenta."	0
42012	"LO QUE DICE EL GOBIERNO""Ese día, después de 3 años de su aprobación en el Congreso entra, por fin, en vigencia uno de los artículos más importantes de la Ley de Medios Audiovisuales: el 161."	0
42885	Pero sería un insigne fracaso de cincuenta años de política atlántica que las cosas llegaran a tal punto.	0
43112	También hubo disminuciones, según las planillas que exhibe el Gobierno, en Corrientes (72%), San Luis (55%), La Pampa (50%, aunque con cifras parciales), Formosa (43%), Entre Ríos (43%) y Córdoba (11%), entre otras provincias.	0
40330	"LO QUE DICE EL GOBIERNO""El 22 de mayo de este año, la Corte Suprema de Justicia determinó la vigencia del artículo 161 y fijó el 7 de diciembre, el 7D como fecha límite para cumplir con la ley."	0
43111	Aunque el avance de la caravana es muy lento, el presidente norteamericano convirtió este tema en uno de sus ejes de la campaña para las legislativas de pasado mañana.	0
42222	También la Unión Europea y la Iglesia Católica de Bolivia llamaron la atención sobre ese giro y pidieron transparencia en el conteo de votos.	0
42037	Las denunciantes, en muchos casos, para hacer escuchar su voz, adoptan la forma del “escrache” en las redes.	0
40312	No se para de la misma manera que el gobierno uruguayo, ahí tenemos una deuda pendiente.	0
40294	Las otras naciones —en especial, los aliados que durante medio siglo han estado bajo la protección del compromiso estadounidense con el orden mundial— deberían tomar este desafío con seriedad y no subordinarlo a la política interna.	0
41655	Más tarde, se supo que el hombre que trasportaba la bomba intentó subir al micro.	0
42663	"""El presidente no tiene rencores por el incidente"", dijo la vocera de la Casa Blanca, Dana Perino."	1
40988	El atacante escapó enseguida sin llevarse nada.Un cliente que recién entraba, y la hija de Ruzack que estaba en el fondo del local, corrieron para ayudar al comerciante.	0
40582	Las trabas para su ratificación se basan en la falta de garantías laborales que ofrece Colombia, país que tiene la mayor tasa de asesinatos de sindicalistas en el mundo, y amenazan la ayuda militar y financiera que Washington le da a Bogotá para combatir el narcotráfico y los grupos armados ilegales.	0
40973	Dos horas después, atacó un sector de aulas y asesinó a otros 30 alumnos.	0
41621	Desde el momento en que, caminando con miedo en la Plaza de Mayo inició junto con otras madres la búsqueda de sus hijos, María Adela Gard de Antokoletz nunca claudicó: se mantuvo en la lucha, hasta que ayer, a los 90 años, le llegó la muerte.	0
40572	Pero envían hacienda a los mercados.	0
40390	Ante los pocos detalles que surgían del apartado lugar en el oriente de Argelia, tampoco estaba claro si alguien fue rescatado finalmente en la operación militar, pero la cifra de rehenes muertos el sábado (siete) es la que los extremistas habían dicho esa mañana que aún tenían en su poder.	0
42578	Pero no estamos evaluando el tema ni hacemos futurología.El 9 de noviembre de 2007, al inaugurarse la planta, fue Uruguay el que decidió preventivamente cerrar la frontera con Argentina.	0
40351	Imagen: Télam.	0
43027	Su hija Silvina Parodi tenía sólo 20 años y estaba embarazada de seis meses y medio cuando fue secuestrada junto a su esposo, Daniel Orozco, de 22, en la casa en la que vivían, en el barrio Alta Córdoba de esta capital.	0
41579	El presidente de EE.UU.	0
42693	Leandro Katz.	0
40569	"No obstante, la concesionaria descartó que ""algún trabajador ferroviario"" estuviera implicado en el incendio."	1
41907	Uno fue el ex Patronato de la Infancia, en San Telmo, violentamente desalojado en 2001.	0
42063	"""Un terrorista hizo detonar su chaqueta de explosivos en el mausoleo de Jomeini."	1
42251	El sitio a veces difunde mensajes de extremistas de la Yihad.	0
41378	Los datos oficiales bonaerenses comprenden desde el 10 de diciembre de 2015 –cuando asumió María Eugenia Vidal– hasta el 21 de octubre último –casi 10 meses–, período en el que hubo 1.010 homicidios dolosos.	0
40003	Sin embargo, esta instancia de consulta debía haberse realizado previamente a la ejecución de las obras, como parte del debido proceso de evaluación de impacto ambiental, según lo establece la ley.	0
43197	Los dictadores permanecen en la mente para envenenar de nuevo, para torturar una vez más.	0
41632	¿Para el dictador?	0
42379	El departamento es lujoso, pero aún así revela una economía en ajuste: en los últimos años debió vender el departamento histórico de la familia en la calle Montevideo -mucho más amplio que éste-, también una chacra que tenía en Capilla del Señor.	0
42515	El asesino fue identificado como Sayfullo Habibullaevic , Saipov, de 29 años, originario de Uzbekistán, pero que vivía desde 2010 en Tampa, Florida, con “green card”, o residencia permanente.	0
42330	Durante los días que duró la protesta, tambièn fueron varios los turistas brasileños que debieron lidiar con el tema.	1
42995	"La fiscal instó a los jurados a ""mirar en los ojos de un cobarde"", y a armarse del valor necesario para condenarlo a morir por un crimen que mató a más gente que el total de norteamericanos que murieron en combate en el Golfo Pérsico."	1
42628	También informaron sobre La korpo, el multimedio de empresarios afines al gobierno, que se enriquecieron en los últimos años.	0
40243	Enrique García Medina Apenas una hora después de la convocatoria, más de trescientas personas ocupaban la esquina.	1
42632	Ese bache fiscal sería cubierto por recursos del fondo anticíclico que se forma con los recursos excedentes de la recaudación tributaria.	0
40962	A ese partido también pertenece el diputado Eduardo Cunha, posiblemente el más desembozado de los políticos responsables de la caída de Dilma.	0
41183	La protesta comenzará el viernes a las catorce y se mantendrá hasta el domingo a las seis de la tarde, en Arroyo Verde, el mismo lugar donde se realizaron los cortes durante el verano.	1
41384	Sin disimulo, la administración de Kirchner se involucró en forma directa al enviar, a las pocas horas de registrados los incidentes del 7 de febrero, un contingente de Gendarmería que sigue apostado en la zona de influencia, y que el viernes participó dando apoyo logístico a los operativos dispuestos por la jueza Graciela Ruata de Leone.	0
41803	O como vamos a llamarlo desde ahora: 7D.	0
40377	Al apelar a la Organización de las Naciones Unidas para que enfrenten el desafío a su autoridad, dio a entender que, para Estados Unidos, la acción común es la estrategia preferida; la acción unilateral es un último recurso.	0
42148	Según dejaron trascender desde las entidades, entre los productores persiste “una actitud de desconfianza hacia el Gobierno”, que sólo irá desapareciendo en la medida que “surjan resultados concretos”.	0
40347	En una reciente carta abierta, Margaret Atwood se cuestiona si será una “mala feminista”.	0
41452	Además, en los 90 aparecieron ocho nuevos asentamientos, para llegar a un total de 22, la mayoría ubicados en el sur de Buenos Aires.	0
41670	En tanto, el presidente George W. Bush asiste a una ceremonia en Virginia para recordar a las víctimas.	0
43217	La personifica Lázaro Báez, un amigo íntimo de la pareja presidencial que pasó de canillita a campeón de la obra pública y amasó una enorme fortuna gracias a los Kirchner.	0
40768	La victoria de Unidad Ciudadana, por 0,21% de los votos, fue confirmada 19 días después por la Justicia.	0
40010	Pero, el episodio revela, además, la importancia absoluta en el balance de poder global de las negociaciones que se realizan en Suiza.	0
41215	"""Mientras estaba dando el discurso (el testigo contra el ex subcomisario Patti en el Congreso) era liberado."	0
41771	Solamente se otorgará permiso para un vehículo por domicilio.	0
42567	* Junto a Tomás Aguerre, Mariano Fraschini, Pablo Carnaghi y Mariano Montes, integrantes del colectivo Artepolítica.com	0
43257	Traté de ayudar luego a otros, pero realmente no podía mover mi brazo.” Saleh Akef, de 22 años, que estaba en la manifestación con su hermano Abdulaziz, de 18 años, recordó que el imán que dirigía las plegarias tartamudeó en shock cuando comenzó a desparramarse el gas lacrimógeno.	1
42928	Al menos 27 personas, casi todos soldados, murieron hoy en Kabul en un ataque suicida contra un micro en el que viajaban militares afganos.	1
42079	La máxima expresión de locura de verano es la expulsión de la profesora Miriam Schlesinger, de la Universidad Bar-Ilan de Tel Aviv, del consejo editorial de una revista académica del Reino Unido, por estar en una universidad israelí.	0
41247	En un escenario mundial de derrota, en el que se congelan salarios y se retroceden las conquistas de los trabajadores, plantear una medida de acción contra un gobierno que está siendo cuestionado por los sectores del poder económico porque no recorta salarios, porque no reduce los presupuestos y porque sigue aplicando políticas de las que se denominan populistas y estatistas, como dijo el presidente de la Sociedad Rural hace una semana, es hacerle el juego a los sectores de la derecha.	0
40767	Hay una frase muy clara en el documento: “Es mucho lo logrado en nuestras décadas de democracia a fuerza de luchas del pueblo: ese es el camino, con memoria y unidad”.	0
41820	"Los futbolistas llegaron al club por la mañana y, en el estacionamiento del Cilindro, se encontraron con una bandera que decía: ""A los jugadores y Cpo."	0
42540	"""El más profundo sentido de la campaña es no regalar la dignidad, la libertad, la patria."	1
